DocumentType,DocumentTitle,Abstract,Author,Editor,BookAuthors,PublicationName,Publisher,PublicationYear,PrintedPublicationYear,PublisherCity,Volume,Issue,StartPage,EndPage,BookTitle,BookSeriesTitle,Descriptors,PMID,ID,Correspondence,ISSN,ISBN,DOI
"Journal Article","Expressed emotion and attributions in the relatives of bipolar patients: An analysis of problem-solving interactions.","Among the relatives of schizophrenic and depressed patients, high expressed emotion (EE) attitudes are associated with 'controllability attributions' about the causes of patients' symptoms and problem behaviors. However, previous studies have judged EE attitudes and causal attributions from the same assessment measure, the Camberwell Family Interview (CFI; C. E. Vaughn and J. P. Leff, 1976). The authors examined causal attributions among relatives of 47 bipolar patients, as spontaneously expressed to patients in family problem-solving interactions during a postillness period. Relatives rated high EE during the patients' acute episode (based on the CFI) were more likely than relatives rated low EE to spontaneously attribute patients' symptoms and negative behaviors to personal and controllable factors during the postillness interactional assessment. Thus, the EE-attribution linkage extends to the relatives of bipolar patients evaluated during a family interaction task. (PsycInfo Database Record (c) 2022 APA, all rights reserved)","Wendel, Jennifer S.;Miklowitz, David J.;Richards, Jeffrey A.;George, Elizabeth L.","","","Journal of Abnormal Psychology","American Psychological Association","2000","","US","109","4","792","796","","","*Attribution;  *Bipolar Disorder;  *Expressed Emotion;  *Family Relations;  *Problem Solving; Family Members","11196006","2000-12687-027","","1939-1846(Electronic);0021-843X(Print)","","https://doi.org/10.1037/0021-843X.109.4.792"
"Journal Article","Combined Psychotherapy and Pharmacotherapy for Mood and Anxiety Disorders in Adults: Review and Analysis.","Studies suggest a complex relationship between cognitive-behavior therapy (CBT) and pharmacotherapy for the combined treatment of mood disorders and anxiety disorders. Combined treatment for depression may have beneficial effects when applied to patients with chronic depression and in cases to prevent relapse. In bipolar disorder there is evidence for a strong effect of psychosocial treatment on the course of the disorder. In the anxiety disorders, there are some benefits in the short term, but combined treatment may limit the maintenance of treatment gains offered by CBT alone. Combined treatment should not be considered the default treatment for mood and anxiety disorders, with the possible exception of bipolar disorder. Instead, decisions whether combined treatment is worth the added cost and effort should be made in relation to the disorder under treatment, the level of severity or chronicity, and the stage of treatment (e.g., acute vs. relapse prevention). (PsycInfo Database Record (c) 2021 APA, all rights reserved)","Otto, Michael W.;Smits, Jasper A. J.;Reese, Hannah E.","","","Clinical Psychology: Science and Practice","Blackwell Publishing","2005","","United Kingdom","12","1","72","86","","","*Affective Disorders;  *Anxiety Disorders;  *Drug Therapy;  *Interdisciplinary Treatment Approach;  *Psychotherapy; Bipolar Disorder; Chronicity (Disorders); Cognitive Behavior Therapy; Major Depression; Relapse Prevention; Severity (Disorders)","","2005-01375-010","Otto, Michael W.: Boston University Center for Anxiety and Related Disorders, 648 Beacon Street, Sixth Floor, Boston, MA, US, 02215, mwotto@bu.edu","1468-2850(Electronic);0969-5893(Print)","","https://doi.org/10.1093/clipsy.bpi009"
"Review-Book","Review of Cognitive-behavioral therapy for bipolar disorder and Cognitive therapy for delusions, voices, and paranoia.","Reviews the books, Cognitive-behavioral therapy for bipolar disorder by Monica Ramirez Basco and A. John Russo (see record 1996-98072-000) and Cognitive therapy for delusions, voices, and paranoia by Paul Chadwick, Max Birchwood, and Peter Trower (see record 1996-97983-000). The mental health service system is largely based on the oft encountered, often implicit, belief among professionals that, since Schizophrenia, Bipolar Disorder, and other severe forms of mental illnesses have been shown to have a biological basis, there is no point in providing psychotherapy for individuals afflicted with these disorders. These two books represent a welcome exception to this situation. While different in many ways, including their treatment goals and many of their theoretical underpinnings, both books represent an attempt to allow the severely mentally ill to benefit from techniques which have been demonstrated to be effective for less severely disturbed populations. Both approaches illustrate ways that the severely mentally ill may be able to be helped through psychosocial intervention, and both acknowledge the importance of client collaboration in treatment, a consideration easy to overlook when the client has a severe mental illness. The books are also similar in that neither one offers sufficient empirical data to support the effectiveness of its approach. The two books reviewed here represent, in the reviewer's opinion, significant contributions to the field of psychotherapy. Even if the clinician takes issue with the techniques presented or with the theoretical assumptions underlying the approaches, he/she should come away with a renewed appreciation of the importance of including the client in treatment planning, even if the client has a severe mental illness. (PsycInfo Database Record (c) 2021 APA, all rights reserved)","Malouf, John","","","","Division of Psychotherapy (29), American Psychological Association","1996","","US","33","4","636","637","","","*Cognitive Behavior Therapy;  *Cognitive Therapy; Auditory Hallucinations; Bipolar Disorder; Delusions; Paranoia; Schizophrenia","","2009-17397-001","","1939-1536(Electronic);0033-3204(Print)","","https://doi.org/10.1037/h0092376"
"Journal Article","The impetus of recovery.","One of my strongest strategies for staying well is really knowing myself. I can see and understand my early symptoms and what to do to keep them from rising in degree. The first thing I do is talk to a trusted natural support in my life. Then, I call my therapist who I trust to decide together what I need to do to cope. This process is not always easy. This has taken me years to have this kind of insight. It takes some bumps and turns in life before you really know what impact it's having on your life. That is if you want something out of life. This is what rehabilitation did for me. It gave me the opportunity to learn about and to re-experience having a valued role. So, my path has been a process of learning how to mix all supports and resources together. This includes family, work, self-care, therapy, medication, and love. For me this is the impetus of recovery. (PsycINFO Database Record (c) 2016 APA, all rights reserved)","Brown, Keysha M.","","","Psychiatric Rehabilitation Journal","International Association of Psychosocial Rehabilitation Services and Department of Rehabilitation Counseling, Sargent College of Health and Rehabilitation Services, Boston University","2009","","US","33","1","60","61","","","*Recovery (Disorders);  *Rehabilitation; Coping Behavior; Symptoms","19592383","2009-11178-011","Brown, Keysha M.: Elmwood Transitional Residence, Rochester Psychiatric Center, 1111 Elmwood Ave, Rochester, NY, US, 14620","1559-3126(Electronic);1095-158X(Print)","","https://doi.org/10.2975/33.1.2009.60.61"
"Journal Article","Coroner’s inquest into an Australian television anchorwoman’s suicide: Implications for clinical practice and suicide prevention.","In 2010, a coroner’s inquest was held into the 2007 suicide of Ms. Charmaine Dragun, an Australian TV news anchorwoman. The main findings were that if Ms. Dragun had been diagnosed with bipolar II disorder and prescribed a mood stabilizer, her suicide could have been prevented; that the “cross-tapering” treatment by her psychiatrist and the clinical management by her health care professionals were inadequate; and that the incorporation of meditation and mindfulness in therapy was inappropriate. In this article, I examine the coroner’s findings and recommendations alongside the evidence tendered at the inquest. I also discuss (a) whether bipolar II disorder is under- or overdiagnosed; (b) the responses to the coroner’s findings on bipolar II disorder; (c) the impact of the coroner’s findings and recommendations on health care professionals and the public; (d) my personal reflections; and (e) my recommendations for making suicide prevention programs more effective: increased open-minded and respectful collaboration among professionals, the importance of educating legal professionals about the reality of clinical practice, and promoting recognized suicide prophylactic measures. For health care professionals worldwide, especially clinicians, this “Australian Story” provides important insights and lessons. (PsycINFO Database Record (c) 2017 APA, all rights reserved)","Khong, Belinda Siew Luan","","","The Humanistic Psychologist","Educational Publishing Foundation","2017","","US","45","1","23","48","","","*Bipolar Disorder;  *Diagnosis;  *Suicide;  *Suicide Prevention; Clinical Practice","","2016-49333-001","Khong, Belinda Siew Luan: Department of Psychology, Macquarie University, 67 Braeside Street, Wahroonga, NSW, Australia, 2076, bkhong@belindakhong.com","1547-3333(Electronic);0887-3267(Print)","","https://doi.org/10.1037/hum0000042"
"Journal Article","Preventing medical noncompliance in the outpatient treatment of bipolar affective disorders.","Evaluated the efficacy of a preventive compliance intervention based on cognitive therapy principles with 11 male and 17 female 24–60 yr old newly admitted lithium outpatients. Half of the Ss received standard medication clinic care; the rest also received the compliance intervention. Global medical regimen adherence at postintervention and at 3- and 6-mo follow-up assessments was assessed by self- and informant reports, physicians' ratings, chart notations, and serum lithium blood levels. Results show that the intervention significantly enhanced compliance at both postintervention and 6-mo follow-up assessment. In addition, intervention Ss significantly less often terminated lithium against medical advice, were hospitalized during the course of the study, or had noncompliance-precipitated episodes. (17 ref) (PsycINFO Database Record (c) 2016 APA, all rights reserved)","Cochran, Susan D.","","","Journal of Consulting and Clinical Psychology","American Psychological Association","1984","","US","52","5","873","878","","","*Bipolar Disorder;  *Cognitive Therapy;  *Drug Therapy;  *Lithium; Treatment Compliance","6501672","1985-04765-001","","1939-2117(Electronic);0022-006X(Print)","","https://doi.org/10.1037/0022-006X.52.5.873"
"Journal Article","Family functioning and mood disorders: A comparison between patients with major depressive disorder and bipolar I disorder.","Within a sample of patients with major depressive disorder (MDD; n = 121) and bipolar affective disorder (BPAD; n = 69), the authors examined (a) diagnostic differences in family functioning at acute episode, (b) diagnostic differences in family functioning at episode recovery, (c) within-group changes in family functioning from acute episode to recovery, and (d) whether within-group changes from acute episode to recovery varied by diagnosis. Using a multidimensional model, the authors evaluated interviewer, patient, and family ratings. Overall, patients with MDD and BPAD evidenced similar levels of family impairment at acute episode and recovery. Generally, patients in both groups experienced improvement in family functioning over time, yet mean scores at recovery continued to range from fair to poor. Although certain specific differences emerged, diagnostic groups appeared to be more similar than different in level and pattern of family functioning. (PsycINFO Database Record (c) 2019 APA, all rights reserved)","Weinstock, Lauren M.;Keitner, Gabor I.;Ryan, Christine E.;Solomon, David A.;Miller, Ivan W.","","","Journal of Consulting and Clinical Psychology","American Psychological Association","2006","","US","74","6","1192","1202","","","*Bipolar Disorder;  *Family Relations;  *Major Depression; Bipolar I Disorder","17154748","2006-22003-020","Weinstock, Lauren M.: Psychosocial Research Program, Butler Hospital, 345 Blackstone Boulevard, Providence, RI, US, 02906, Lauren_Weinstock@brown.edu","1939-2117(Electronic);0022-006X(Print)","","https://doi.org/10.1037/0022-006X.74.6.1192"
"Journal Article","A shared lived experience of a psychologist battling a mental health crisis.","This article is a combined 1st-person narrative of a mental health professional with a mental illness, referred to as a prosumer, and her psychologist friend who stood by her during her 1st manic episode with psychosis. Challenges prosumers face are highlighted. These include stigma, questions about the impact of illness on ability to work in the field, and the choice of whether to disclose about the illness and to whom. Disclosures about lived experience within public settings, outside of the therapy room, are encouraged for several reasons. Visibility can reinforce recovery, promote understanding and accurate empathy, encourage help-seeking behavior, destigmatize mental illness, and reinforce the development of trustworthy and credible supports. This frank and detailed narrative provides an example of a psychologist with bipolar disorder who, with support and active treatment, bravely overcame a mental health crisis and returned to wellness and contribution to the mental health field. (PsycInfo Database Record (c) 2022 APA, all rights reserved)","Vierthaler, Juli M.;Elliott, Erin C.","","","Psychological Services","Educational Publishing Foundation","2022","","US","19","1","46","48","","","*Mental Disorders;  *Mental Health Personnel;  *Psychologists;  *Recovery (Disorders);  *Stigma; Crises; Experiences (Events); Mania; Narratives; Psychosis; Self-Disclosure; Treatment","32673035","2020-51959-001","Elliott, Erin C.: Mental Health Service Line, Atlanta VA Health Care System, 1670 Clairmont Road, Decatur, GA, US, 30033, erin.elliott@va.gov","1939-148X(Electronic);1541-1559(Print)","","https://doi.org/10.1037/ser0000489"
"Journal Article","Family functioning in bipolar I disorder.","In a sample of 62 patients with Bipolar I disorder, the authors used a repeated measures longitudinal design to examine whether global family functioning was associated with the presence of a concurrent bipolar episode as well as whether global family functioning was associated with the presence of manic and depressive episodes in the following 3 months. Participants were recruited for a randomized clinical trial examining the efficacy of family treatments combined with pharmacotherapy for bipolar disorder. Global family functioning was repeatedly measured with both clinician-rated and patient-rated assessment instruments over the 28-month study period. Results indicated that mood episodes were associated with concurrent global family functioning within individuals, but global family functioning was not associated with episode status in the subsequent 3 months. The repeated measures nature of these results suggests that global family functioning and bipolar episodes may fluctuate in concert with each other but that global family functioning is not associated with subsequent change in episode status. (PsycINFO Database Record (c) 2019 APA, all rights reserved)","Uebelacker, Lisa A.;Beevers, Christopher G.;Battle, Cynthia L.;Strong, David;Keitner, Gabor I.;Ryan, Christine E.;Solomon, David A.;Miller, Ivan W.","","","Journal of Family Psychology","American Psychological Association","2006","","US","20","4","701","704","","","*Bipolar Disorder;  *Emotional States;  *Family Relations; Bipolar I Disorder","17176206","2006-22333-020","Uebelacker, Lisa A.: Psychosocial Research Program, Butler Hospital, 345 Blackstone Boulevard, Providence, RI, US, 02906, Lisa_Uebelacker@brown.edu","1939-1293(Electronic);0893-3200(Print)","","https://doi.org/10.1037/0893-3200.20.4.701"
"Journal Article","Psychopharmacology of aggression in children and adolescents with primary neuropsychiatric disorders: A review of current and potentially promising treatment options.","Research examining the role of pharmacological therapy in the treatment of children and adolescents with clinical disorders is growing. Clinical disorders that present with comorbid aggression can add a challenge to treatment. Child and adolescent neuropsychiatric disorders associated with aggression include attention-deficit hyperactivity disorder, various mood disorders and in particular bipolar disorders/pediatric mania, schizophrenia, mental retardation, oppositional defiant disorder, conduct disorder, and autism spectrum disorders. This review describes the psychopharmacy to treat these disorders and the aggression that often appears comorbidly. Existing literature regarding the efficacy and safety of psychotropics for youth with neuropsychiatric disorders also is discussed. In addition, general guidelines for psychopharmacy of aggression in children and adolescents are presented. Studies reviewed in this article provide evidence for the use of psychostimulants, alpha-2 agonists, beta blockers, lithium, anticonvulsant mood-stabilizers, atypical antipsychotics, traditional antipsychotics, and selective serotonin reuptake inhibitors in treating pediatric aggression with the choice of medication dependent on symptomology. Despite increased support for pediatric psychotropic use, there is a need for more long-term safety and efficacy studies of existing medications and newer, safer, and more effective agents with fewer side effects for the pharmacological treatment of all childhood disorders in which aggression is prominent. (PsycINFO Database Record (c) 2016 APA, all rights reserved)","Nevels, Robert M.;Dehon, Erin E.;Alexander, Katrina;Gontkovsky, Samuel T.","","","Experimental and Clinical Psychopharmacology","American Psychological Association","2010","","US","18","2","184","201","","","*Aggressive Behavior;  *Comorbidity;  *Disorders;  *Neuropsychiatry;  *Psychopharmacology; Adolescent Psychopathology; Child Psychopathology; Treatment","20384430","2010-06751-009","Gontkovsky, Samuel T.: Center for Neuroscience and Neurological Recovery, Methodist Rehabilitation Center, 1350 East Woodrow Wilson, Jackson, MS, US, 39216, sgontkovsky@hotmail.com","1936-2293(Electronic);1064-1297(Print)","","https://doi.org/10.1037/a0018059"
"Journal Article","Explanatory style change during cognitive therapy for unipolar depression.","We administered the Attributional Style Questionnaire to 39 unipolar depressed patients at the beginning and end of cognitive therapy and at one-year follow-up, and we administered it to 12 bipolar patients during a depressed episode. A pessimistic explanatory style for bad events correlated with severity of depression for unipolars at cognitive therapy intake (r = .56, p < .0002), termination (r = .57, p < .0008), and one-year follow-up (r = .64, p < .0005) and among the bipolars (r = .63, p < .03). Explanatory style and depressive symptoms significantly improved by the end of cognitive therapy and remained improved at one-year follow-up. For the unipolars in cognitive therapy, explanatory style change from intake to termination correlated with change in depressive symptoms from intake to termination (r = .65, p < .0001). These results suggest that explanatory style may be one of the mechanisms of change for unipolar depressive patients undergoing cognitive therapy. (PsycInfo Database Record (c) 2022 APA, all rights reserved)","Seligman, Martin E. P.;Castellon, Camilo;Cacciola, John;Schulman, Peter;Luborsky, Lester;Ollove, Maxine;Downing, Robert","","","Journal of Abnormal Psychology","American Psychological Association","1988","","US","97","1","13","18","","","*Attribution;  *Cognitive Therapy;  *Major Depression; Bipolar Disorder; Followup Studies","3351107","1988-17750-001","","1939-1846(Electronic);0021-843X(Print)","","https://doi.org/10.1037/0021-843X.97.1.13"
"Journal Article","Employment outcomes in family-aided assertive community treatment.","Family-aided assertive community treatment (FACT) was enhanced by adding vocational specialists to help persons with severe mental illness obtain competitive employment. Ss were 69 18–55 yr olds with either schizophrenia, schizoaffective, schizophreniform or mood disorder. Results were then tested against those of conventional vocational rehabilitation (CVR). The FACT cohort demonstrated significantly better employment rates than did the CVR, while negative symptoms declined in the former and increased in the latter. No evidence was found that competitive work presented a significant risk for relapse. (PsycInfo Database Record (c) 2020 APA, all rights reserved)","McFarlane, William R.;Dushay, Robert A.;Deakins, Susan M.;Stastny, Peter;Lukens, Ellen P.;Toran, Joanne;Link, Bruce","","","American Journal of Orthopsychiatry","American Orthopsychiatric Association, Inc.","2000","","US","70","2","203","214","","","*Community Mental Health Services;  *Family;  *Mental Disorders;  *Occupational Guidance;  *Vocational Rehabilitation; Severity (Disorders); Vocational Counselors; Assertive Community Treatment; Serious Mental Illness","10826032","2000-15379-006","","1939-0025(Electronic);0002-9432(Print)","","https://doi.org/10.1037/h0087819"
"Comment/Reply","Psychological Treatment and Medication for the Mood and Anxiety Disorders: Moderators, Mediators, and Domains of Outcome.","Comments on the article by M. Otto et al (this issue; see article 2005-01375-010) regarding combined treatments for mood and anxiety disorders in adults. The current author notes that studies that combine pharmacotherapy with psychological treatment for the mood and anxiety disorders must consider the role of moderators (pretreatment variables that specify the conditions under which treatments are effective) and mediators (change mechanisms in the causal pathways between treatments and outcomes) in explaining the impact of experimental treatments. This article gives examples of the kinds of moderators and mediators--both psychosocial and biological--that are important to examine in combination treatment studies. It conceptualizes outcome as involving multiple domains, including mood and anxiety symptoms, life functioning, and illness costs. Research should also examine the appropriate sequencing of pharmacological and psychosocial interventions and how this sequencing may vary from disorder to disorder. (PsycInfo Database Record (c) 2021 APA, all rights reserved)","Miklowitz, David J.","","","","Blackwell Publishing","2005","","United Kingdom","12","1","97","99","","","*Affective Disorders;  *Anxiety Disorders;  *Drug Therapy;  *Interdisciplinary Treatment Approach;  *Psychotherapy; Biology; Bipolar Disorder; Chronicity (Disorders); Cognitive Behavior Therapy; Major Depression; Psychosocial Factors; Relapse Prevention; Severity (Disorders); Treatment Outcomes","","2005-01375-013","Miklowitz, David J.: Department of Psychology, University of Colorado, Muenzinger Building, Boulder, CO, US, 80309-0345, miklow@psych.colorado.edu","1468-2850(Electronic);0969-5893(Print)","","https://doi.org/10.1093/clipsy.bpi012"
"Journal Article","Why and how people decide to stop taking prescribed psychiatric medication: Exploring the subjective process of choice.","Objective: Despite the piling evidence supporting the effectiveness of psychiatric medication, research has consistently shown that only about half of those administered treatment actually take it as prescribed. The purpose of the present study was to explore why and how people with a serious mental illness (SMI) choose to stop taking prescribed medication. Method: Seven persons with SMI who had been prescribed and had used medication in the past, but had not taken medication for at least a year, participated in semi-structured interviews, which were recorded and later transcribed. Qualitative analysis provided a foundation for sketching a hypothesized five-stage model of the process involved in choosing to stop medication. Results: This study revealed the subjective experience of taking medication, dilemmas it evokes, and the struggle to develop a personal perspective, plan and choice with regard to medication use. Conclusions: Implications of these findings are discussed, emphasizing the importance of the 'doctor-patient' relationship context. (PsycInfo Database Record (c) 2020 APA, all rights reserved)","Roe, David;Goldblatt, Hadass;Baloush-Klienman, Vered;Swarbrick, Margaret;Davidson, Larry","","","Psychiatric Rehabilitation Journal","International Association of Psychosocial Rehabilitation Services and Department of Rehabilitation Counseling, Sargent College of Health and Rehabilitation Services, Boston University","2009","","US","33","1","38","46","","","*Drug Therapy;  *Mental Disorders;  *Prescription Drugs;  *Serious Mental Illness; Choice Behavior; Decision Making","19592378","2009-11178-006","Roe, David: Department of Community Mental Health, Faculty of Social Welfare & Health Sciences, University of Haifa, Haifa, Israel, 31905, droe@univ.haifa.ac.il","1559-3126(Electronic);1095-158X(Print)","","https://doi.org/10.2975/33.1.2009.38.46"
